{
  "$schema": "https://json-schema.org/draft/2020-12/schema",
  "$id": "https://github.com/Maksym-Denysiuk/CarsSearch/docs/results.schema.json",
  "title": "CarsSearch request results",
  "description": "Schema for Requests/<request_id>/results.json — one entry per car model found for that request, with the real for-sale offerings located for it. Prices are stored as integers so budget maths and UI sorting are trivial; country is an EU/EEA-restricted enum so the 'no non-EU prices' rule is enforced by schema rather than by prompt.",
  "type": "object",
  "required": ["schema_version", "request_id", "generated", "metadata", "models"],
  "additionalProperties": false,
  "properties": {
    "schema_version": { "type": "integer", "const": 1 },
    "request_id": { "type": "string", "pattern": "^req-[0-9]{4}-[a-z0-9]+(-[a-z0-9]+)*$" },
    "generated": { "type": "string", "description": "ISO-8601 date or timestamp of the last write." },
    "metadata": { "$ref": "#/$defs/metadata" },
    "models": { "type": "array", "items": { "$ref": "#/$defs/model" } }
  },
  "$defs": {
    "metadata": {
      "type": "object",
      "required": ["currency", "specs_disclaimer"],
      "additionalProperties": false,
      "properties": {
        "currency": { "type": "string", "description": "Default currency for monetary fields (EUR)." },
        "specs_disclaimer": { "type": "string", "description": "Confidence caveat for spec fields that were not individually verified per model." },
        "notes": { "type": "array", "items": { "type": "string" } },
        "migration": {
          "type": "object",
          "description": "Present only on results.json files produced by a one-shot migration of an earlier dataset. Records exactly what was carried over and what was dropped, so the losses are counted rather than silent.",
          "required": ["source", "migrated_at", "models", "offerings_kept", "offerings_dropped", "drop_reasons"],
          "additionalProperties": false,
          "properties": {
            "source": { "type": "string" },
            "migrated_at": { "type": "string" },
            "models": { "type": "integer", "minimum": 0 },
            "offerings_kept": { "type": "integer", "minimum": 0 },
            "offerings_dropped": { "type": "integer", "minimum": 0 },
            "drop_reasons": {
              "type": "object",
              "description": "reason -> count.",
              "additionalProperties": { "type": "integer", "minimum": 0 }
            }
          }
        }
      }
    },
    "model": {
      "type": "object",
      "description": "One car model found for this request. The spec fields (model_variant, roof_removable, roof_mechanism, engine, fuel_or_charge_consumption, tank_or_battery_size, doors, tax, import_tax, photo) are OPTIONAL: they come from a model's spec page, and a producer that only reads listing search results cannot source them. Such a producer must omit them entirely rather than write a placeholder — a 'tbd' tax written by something that never consulted a tax table reads as a researched unknown when it is really an unasked question, which is the same class of fabrication the offering firewall exists to prevent. Consumers must therefore treat every spec field as possibly absent; docs/app.js renders a blank cell. The identifying, provenance and offering fields below stay required, because anything producing a model row at all can answer them.",
      "required": [
        "id",
        "name",
        "manufacturer",
        "group_id",
        "group_name",
        "brand_id",
        "brand_name",
        "body_type",
        "tier",
        "first_year",
        "average_budget_eur",
        "average_budget_basis",
        "search_status",
        "search_status_note",
        "offerings",
        "offering_search_log"
      ],
      "additionalProperties": false,
      "properties": {
        "id": { "type": "string", "pattern": "^[a-z0-9]+(-[a-z0-9]+)*$", "description": "Stable kebab-case identifier, unique within this request. Rows are replaced wholesale by id, which is what makes a re-done model idempotent." },
        "name": { "type": "string" },
        "manufacturer": { "type": "string", "description": "Manufacturer as stated by the source material. brand_name is the checklist's canonical name; the two can differ (e.g. 'Bentley (Mulliner)' vs 'Bentley')." },
        "group_id": { "type": ["string", "null"], "description": "Config/brands.json group this model's brand belongs to; null when the brand is not on the checklist." },
        "group_name": { "type": ["string", "null"] },
        "brand_id": { "type": ["string", "null"], "description": "Config/brands.json brand id; null when the manufacturer is not on the checklist." },
        "brand_name": { "type": ["string", "null"] },
        "body_type": { "$ref": "#/$defs/body_type" },
        "tier": { "$ref": "#/$defs/tier" },
        "model_variant": { "type": "string", "description": "Generation / variant / trim detail and production-status notes." },
        "first_year": { "type": ["integer", "null"], "description": "First model year of this generation/variant, when known." },
        "average_budget_eur": { "type": ["integer", "null"], "minimum": 0, "description": "round(mean(offerings.price_eur)) where offerings exist; otherwise a stated estimate; null when unpriced." },
        "average_budget_basis": { "type": "string", "description": "How average_budget_eur was derived." },
        "roof_removable": { "type": "boolean" },
        "roof_mechanism": { "type": "string", "description": "Whether opening/removing the roof is powered or manual (free text). Renamed from the legacy roof_automated_process." },
        "engine": { "type": "string" },
        "fuel_or_charge_consumption": { "type": "string" },
        "tank_or_battery_size": { "type": "string" },
        "doors": { "type": "integer", "minimum": 0, "description": "Not pinned to 2 — requests are no longer roadster-only. Minimum 0, not 1: the Morgan Super 3 is an open three-wheeler with no doors at all, so 0 is a sourced fact and a floor of 1 rejected it. Negative is still refused, which is the part that was doing the work." },
        "tax": { "$ref": "#/$defs/tax_value" },
        "import_tax": { "$ref": "#/$defs/tax_value" },
        "photo": {
          "oneOf": [
            { "type": "null" },
            {
              "type": "object",
              "required": ["url", "source_url", "source_kind"],
              "additionalProperties": false,
              "properties": {
                "url": { "type": "string", "format": "uri" },
                "source_url": { "type": ["string", "null"], "description": "The page the image was taken from; null when provenance was not recorded." },
                "source_kind": { "type": "string", "enum": ["og:image", "listing-page", "manufacturer", "legacy-unknown"] }
              }
            }
          ]
        },
        "search_status": {
          "type": "string",
          "enum": ["pending", "completed", "completed_no_offerings", "completed_insufficient_sources", "failed"],
          "description": "completed_insufficient_sources means fewer than 5 surviving offerings or fewer than 2 distinct source domains — written honestly rather than padded."
        },
        "search_status_note": { "type": ["string", "null"], "description": "Why the status is what it is (e.g. the legacy status this was migrated from)." },
        "offerings": { "type": "array", "items": { "$ref": "#/$defs/offering" } },
        "offering_search_log": {
          "type": "array",
          "description": "One entry per attempted round of the offerings ladder, so the site can show WHY a model has few offerings.",
          "items": { "$ref": "#/$defs/search_round" }
        },
        "gearbox": {"type": "string", "description": "Transmission type, e.g. '8-speed automatic (torque converter)', '7-speed dual-clutch', '6-speed manual', 'single-speed reduction gear'. If both manual and automatic are offered, say so. Written only when actually sourced; absent -- never null -- when it was not."},
        "spec_source": {"type": "object", "description": "Where this row's spec fields came from. Present only when they were filled by the enrichment step; absent on rows whose specs were hand-researched or never filled. A spec claim with no page behind it is discarded rather than written, so this object existing is the assertion that a page was read.", "required": ["url", "retrieved_at", "method"], "additionalProperties": false, "properties": {"url": {"type": "string", "description": "The page the values were read from."}, "retrieved_at": {"type": "string", "description": "ISO-8601 timestamp."}, "method": {"type": "string", "enum": ["local-llm-web-search", "claude-manual-verification"], "description": "How the page was reached. An enum so a future method is a visible change. 'claude-manual-verification' is a spec corrected by hand against a named source page after the enrichment step wrote a wrong value; it is still a page that was read, so it carries the same url/retrieved_at obligation."}}},
        "body_style": {"type": "string", "description": "The body style or styles this model is actually sold in, in the words the specification page uses, e.g. 'saloon and estate', '5-door hatchback', 'coupe and convertible', '4-door fastback'. List every style currently offered; if only one, name only that one. This is what the manufacturer builds, not what anyone was looking for. Written only when actually sourced; absent -- never null -- when it was not."}
      }
    },
    "offering": {
      "type": "object",
      "required": ["url", "source_domain", "country", "location", "price_eur", "price_display", "found_in_round", "captured_at"],
      "additionalProperties": false,
      "properties": {
        "url": {
          "type": "string",
          "format": "uri",
          "pattern": "^https?://",
          "description": "Must be a URL the browser actually visited — the hallucination firewall drops anything else."
        },
        "source_domain": { "type": "string", "description": "Registrable host of url, lowercased, without 'www.'." },
        "country": { "$ref": "#/$defs/country" },
        "location": { "type": ["string", "null"], "description": "City/region as displayed by the source; null when the source shows none." },
        "price_eur": { "type": "integer", "minimum": 0, "description": "Asking price in EUR. Must be substring-present in the fetched page text or the offering is dropped." },
        "price_display": { "type": "string", "description": "Price exactly as displayed on the source page." },
        "found_in_round": { "type": ["integer", "null"], "minimum": 1, "description": "Which ladder round surfaced it; null for migrated data that predates the ladder." },
        "captured_at": { "type": ["string", "null"], "description": "ISO-8601 timestamp of the fetch; null for migrated data." },
        "year": { "type": ["integer", "null"], "description": "Model year as the listing card published it; null when the card showed none (a brand-new car has no first registration) or when it could not be read. Optional, and null-when-unknown rather than omitted-when-unknown, because this is the field a not_older_than request is about: publishing it is what makes that filter auditable from this file instead of only from a live re-run." },
        "mileage": { "type": ["string", "null"], "description": "Odometer reading exactly as displayed by the source, units included ('123.990 km'). A string because the sources' formatting varies and reparsing it into a number here would invent precision." },
        "fuel": { "type": ["string", "null"], "description": "Fuel type as the source labels it, in the source's own language ('Diesel', 'Hibrido'). Not normalised to an enum: a mapping would have to guess at labels that vary per market." },
        "colour": {"type": "string", "description": "Exterior colour of THIS car exactly as the advert states it. Null if the advert does not state one -- never infer a colour from a photo description or from the model. Written only when actually sourced; absent -- never null -- when it was not."},
        "condition_notes": {"type": "string", "description": "Any defect, damage, accident history, outstanding repair or warning the advert itself states about THIS car, quoted or closely paraphrased. Null if the advert states none. Null means the advert was silent -- it does NOT mean the car is undamaged, so never write 'no problems', 'good condition' or any other reassurance here. Written only when actually sourced; absent -- never null -- when it was not."},
        "enrichment": {"type": "string", "enum": ["enriched", "listing_gone", "fetch_failed", "not_stated"], "description": "Outcome of re-reading this listing's own page for the per-car fields. 'listing_gone' means the advert 404'd -- it sold, which is ordinary and not an error. 'not_stated' means the page was read and stated none of them. Absent means the offering predates enrichment."},
        "title": {"type": "string", "description": "The advert's own headline for THIS car, copied verbatim from the search-results card. A seller wrote it, so it names the trim and generation more reliably than anything else on the card -- and it may also carry dealer noise, punctuation and marketing words. It is a label, not a source: never read a claim about the car out of it. Written only when actually sourced; absent -- never null -- when it was not."}
      }
    },
    "search_round": {
      "type": "object",
      "required": ["round", "source", "url", "found", "new", "duplicates", "dropped"],
      "additionalProperties": false,
      "properties": {
        "round": { "type": "integer", "minimum": 1 },
        "source": { "type": "string", "description": "Source adapter id, e.g. 'standvirtual'." },
        "url": { "type": "string", "description": "The exact URL fetched for this round." },
        "found": { "type": "integer", "minimum": 0, "description": "Cards parsed off the page. Equals new + duplicates." },
        "new": { "type": "integer", "minimum": 0, "description": "Not seen in any earlier round or from any earlier source." },
        "duplicates": { "type": "integer", "minimum": 0, "description": "Already seen in an earlier round — the progressive-exclusion counter." },
        "dropped": { "type": "integer", "minimum": 0, "description": "A SUBSET OF new: those that were fetched, examined and then rejected by the firewall (unvisited URL, price not in page text, non-EU/EEA country, title does not mention the searched model, listed year older than the request allows). Not a fourth disjoint bucket — do not expect new + duplicates + dropped to equal found. A producer that verifies only the first N new cards per source leaves the remainder never examined, so new - dropped overstates how many were actually kept; firewall_kept in the brand's diagnostics is the number that were." },
        "error": { "type": ["string", "null"], "description": "Timeout/block/parse failure for this round; the ladder continues to the next rung regardless." }
      }
    },
    "tax_value": {
      "type": "object",
      "description": "Typed from the start so 'TBD' never has to migrate from string to number later.",
      "required": ["status", "value_eur", "basis"],
      "additionalProperties": false,
      "properties": {
        "status": { "type": "string", "enum": ["tbd", "known", "not_applicable"] },
        "value_eur": { "type": ["integer", "null"], "minimum": 0 },
        "basis": { "type": "string", "description": "How the value was determined; empty string while status is tbd." }
      }
    },
    "body_type": {
      "type": "string",
      "enum": [
        "hatchback",
        "sedan",
        "estate",
        "coupe",
        "roadster",
        "convertible",
        "suv-compact",
        "suv-midsize",
        "suv-large",
        "mpv",
        "pickup",
        "van"
      ],
      "description": "Kept identical to request.schema.json's body_type enum — tools/verify.py asserts the two lists match."
    },
    "tier": {
      "type": "string",
      "enum": ["mainstream", "premium", "exotic", "ultra-exotic", "not yet available", "unconfirmed"],
      "description": "Price-derived market tier. Pure function of average_budget_eur plus the sold-out/bespoke and trim-spread exceptions; never hand-picked against the number."
    },
    "country": {
      "type": "string",
      "description": "ISO-3166 alpha-2, restricted to EU/EEA. A listing outside this set is dropped by the firewall, not stored.",
      "enum": [
        "AT", "BE", "BG", "HR", "CY", "CZ", "DK", "EE", "FI", "FR",
        "DE", "GR", "HU", "IE", "IT", "LV", "LT", "LU", "MT", "NL",
        "PL", "PT", "RO", "SK", "SI", "ES", "SE",
        "IS", "LI", "NO"
      ]
    }
  }
}
